{
  "protocol_version": "0.3.0",
  "profile": "folderbase-reorganization-plan-v1",
  "id": "reorg_project_cleanup",
  "generation": 1,
  "folderbase_id": "folderbase_019f9b75-0000-7000-8000-000000000002",
  "path_profile": "portable-case-sensitive-v1",
  "analysis_scope": {
    "manifest_sha256": "aaaaaaaaaaaaaaaaaaaaaaaaaaaaaaaaaaaaaaaaaaaaaaaaaaaaaaaaaaaaaaaa",
    "ignore_policy": {
      "expectation": "absent",
      "path": ".folderbaseignore"
    },
    "structural_changes_policy": "approve",
    "nested_boundaries": [],
    "operation_closure": [
      {
        "expectation": "absent",
        "path": "Canonical"
      },
      {
        "expectation": "absent",
        "path": "Canonical/approved.pdf"
      },
      {
        "expectation": "directory",
        "path": "Proposals"
      },
      {
        "expectation": "file",
        "path": "Proposals/approved.pdf",
        "sha256": "cccccccccccccccccccccccccccccccccccccccccccccccccccccccccccccccc",
        "byte_count": 10000000000
      }
    ],
    "declared_entries": [
      {
        "expectation": "file",
        "path": "Notes/decision.md",
        "sha256": "eeeeeeeeeeeeeeeeeeeeeeeeeeeeeeeeeeeeeeeeeeeeeeeeeeeeeeeeeeeeeeee",
        "byte_count": 512
      }
    ]
  },
  "analysis_scope_digest": "d1593f60460548508985a2f8c712a91e0505bdd1fc0fe644a02b528a02e09b4a",
  "questions": [
    {
      "id": "approved_proposal",
      "prompt": "Which proposal was approved?",
      "answer_type": "single_choice",
      "required": true,
      "options": [
        "june",
        "july"
      ],
      "answer": {
        "type": "single_choice",
        "value": "july"
      }
    }
  ],
  "rationale": "Keep one current narrative while preserving every source proposal.",
  "template_references": [
    "folderbase.project@0.2.2"
  ],
  "operations": [
    {
      "kind": "create_directory",
      "path": "Canonical"
    },
    {
      "kind": "move_file",
      "source_path": "Proposals/approved.pdf",
      "destination_path": "Canonical/approved.pdf",
      "expected_sha256": "cccccccccccccccccccccccccccccccccccccccccccccccccccccccccccccccc",
      "expected_byte_count": 10000000000
    }
  ],
  "plan_digest": "17151346f77824f00df7c211c448a8ba4217e53512fde785aafd574e980185c8"
}
